{"$schema":"https://json-schema.org/draft/2020-12/schema","$id":"https://channelbridge.local/schemas/feed-v1","title":"Independent ChannelBridge Feed 1.0","type":"object","required":["feed_version","partner_id","generated_at","programs"],"properties":{"feed_version":{"const":"1.0"},"partner_id":{"type":"string","pattern":"^[a-z0-9-]+$"},"generated_at":{"type":"string","format":"date-time"},"programs":{"type":"array","items":{"type":"object","required":["content_id","type","title","description","language","territories"],"properties":{"content_id":{"type":"string"},"type":{"enum":["movie","series","season","episode"]},"title":{"type":"string","maxLength":300},"description":{"type":"string","maxLength":5000},"language":{"type":"string"},"territories":{"type":"array","items":{"type":"string"}},"artwork":{"type":"object","properties":{"url":{"type":"string","format":"uri"},"width":{"type":"integer","minimum":1},"height":{"type":"integer","minimum":1}}},"availability":{"type":"array"}}}}},"additionalProperties":false}
