{"feed_version":"1.0","partner_id":"northstar-media","generated_at":"2026-07-21T16:00:00Z","programs":[{"content_id":"NSM-MOV-001","type":"movie","title":"Glass Atlas","description":"A fictional cartographer follows a signal across an imagined coast.","language":"en-US","territories":["US","CA"],"artwork":{"url":"https://example.invalid/artwork/glass-atlas.jpg","width":1920,"height":1080},"availability":[{"territory":"US","starts_at":"2026-08-01T00:00:00Z","ends_at":"2027-08-01T00:00:00Z"}]}]}
